,text,source,part,Happiness_M,Sadness_M,Anger_M,Disgust_M,Fear_M,Pride_M,Valence_M,Arousal_M,Irony_M,norm_Happiness_M,norm_Sadness_M,norm_Anger_M,norm_Disgust_M,norm_Fear_M,norm_Pride_M,norm_Valence_M,norm_Arousal_M,z_score_Happiness_M,z_score_Sadness_M,z_score_Anger_M,z_score_Disgust_M,z_score_Fear_M,z_score_Pride_M,z_score_Valence_M,z_score_Arousal_M,total_z_score
479,Adrian Zandberg: Rosja musi zapłacić za tę zbrodniczą agresję głęboką recesją i bankructwem,,11,1.0,2.4,3.2,2.8,2.6,1.2,1.8,3.0,0.0,0.0,0.35,0.55,0.4499999999999999,0.4,0.0499999999999999,0.2,0.5,0.7028090943480242,1.102831250908519,1.1981444637568175,1.4234616612920392,2.0051641346700104,0.5813143579154293,0.945167376978211,0.8026442599062428,8.761536599775294
1548,"Ci, którzy tego oczekują,… More POLSATNEWS.PL Zandberg: wspomnienie o Powstaniu zastępuje rozkrzyczany nacjonalista palący tęczową flagę - Polsat News",,29,1.6,1.2,2.0,1.8,1.2,1.2,2.4,1.8,1.0,0.15,0.0499999999999999,0.25,0.2,0.0499999999999999,0.0499999999999999,0.35,0.2,0.0576559634393754,0.6159360134212288,0.0436857581793179,0.2177881870800934,0.4075242569935894,0.5813143579154293,0.2920581185084002,0.7992262525448753,3.01518890808231
1635,"Razem i Zandberg popierają dzisiejszaą prowokację pod pałacem. Wiedzą, ze wybory prezydenckie już przegrali, ale zawsze można jeszcze pomoc PIS-owi.",twitter,38,1.0,1.2,2.2,2.6,1.2,1.0,1.6,2.2,2.0,0.0,0.0499999999999999,0.3,0.4,0.0499999999999999,0.0,0.15,0.3,0.7028090943480242,0.6159360134212288,0.2360955424422346,1.1823269664496503,0.4075242569935894,0.8114075297411351,1.1628704631348146,0.2652694150611691,5.384239281591846
3868,"A tak zupełnie obiektywnie: kto jest większym szkodnikiem na polskiej scenie publicznej spośród zwolenników lewicy: Zandberg, Jaszczur czy Biedroń?",twitter,47,1.0,1.4,3.2,3.6,1.6,1.0,1.2,3.2,2.0,0.0,0.0999999999999999,0.55,0.65,0.15,0.0,0.0499999999999999,0.55,0.7028090943480242,0.3294748026996042,1.1981444637568175,2.3880004406615964,0.281815283481725,0.8114075297411351,1.598276635448022,1.069622678648096,8.37955092878502
7671,SE.PL Zandberg o zaangażowaniu Polaków w pomoc uchodźcom.,,0,1.2,1.4,1.2,1.0,1.0,1.4,2.8,1.6,0.0,0.0499999999999999,0.0999999999999999,0.0499999999999999,0.0,0.0,0.0999999999999999,0.4499999999999999,0.15,0.487758050711808,0.3294748026996042,0.7259533788723483,0.7467505922894634,0.7521940272312464,0.3512211860897234,0.1433480538048069,1.0662046712867284,4.6029047629857285
